{
  "packet_version": "plc_paper_observation_packet_v1",
  "paper_only": true,
  "authority": "paper_observation_no_order_authority",
  "packet_id": "paper-SQ02_DOWNSIDE_CONT_V0-snapshot-sq02-local-001",
  "created_at_ms": 3000,
  "preview": {
    "adapter_version": "plc_read_only_runtime_adapter_v1",
    "read_only": true,
    "authority": "read_only_no_order_authority",
    "source_snapshot_id": "snapshot-sq02-local-001",
    "snapshot_feature_timestamp_ms": 1000,
    "runtime_clock_ms": 2000,
    "strategy_contract_id": "SQ02_DOWNSIDE_CONT_V0",
    "strategy_contract_status": "frozen",
    "trade_intent": {
      "decision": "allow",
      "strategy_contract_id": "SQ02_DOWNSIDE_CONT_V0",
      "campaign_id": "read-only-runtime-preview",
      "session_id": "readonly-snapshot-sq02-local-001",
      "direction": "SHORT",
      "action": "enter",
      "trigger_reason": "setup_present",
      "invalidation_reason": null,
      "evidence_text": "read_only_runtime_preview_contract_conditions_satisfied",
      "no_exchange_side_effect": true
    },
    "rejection_reasons": [],
    "no_exchange_side_effect": true
  },
  "review_status": "pending_review",
  "operator_notes": ["paper_observation_only"],
  "reviewed_by": null,
  "reviewed_at_ms": null,
  "prohibited_actions": [
    "order_placement",
    "order_cancellation",
    "exchange_mutation",
    "real_account_read",
    "runtime_profile_change"
  ],
  "no_exchange_side_effect": true
}
